Relation,Entity1,Entity2
inaugurates,pm modi,rs 8500 crore worth projects in tripura
unveils,pm modi,rs 8500 crore worth projects in tripura
attracts, corporate transparency act ruling,attention as tax season rolls on
hold,navy officials,a press briefing on president biden's fiscal 2025 navy budget
unveils,pm modi,125-feet tall statue of medieval-era ahom general lachit borphukan
honored, wwii ‘ghost army’,with congressional gold medal
honored, wwii ‘ghost army’,for saving u.s. lives in wwii
honored,navy officials,with congressional gold medal
receives, wwii ‘ghost army’,with congressional gold medal
